fecha_consulta,pure_id,uuid,tipo,titulo,autores,person_uuids,total_autores,organizaciones,organizaciones_externas,organizacion_responsable,estatus_publicacion,anio_publicacion,revista,workflow,created_by,created_date,modified_by,modified_date,portal_url,version,system_name,created_date_mty,modified_date_mty,created_day_mty,modified_day_mty,created_month
2026-05-01,15746828,10b75fec-81c2-4029-a109-47dd064c6b68,ContributionToJournal,Estrogen mitogenic action. III. Is phenol red a 'red herring'?,Jorge E. Moreno-Cuevas; David A. Sirbasku,032e6a6b-2256-4dc3-b523-ac05c6bd2927,2.0,,ExternalOrganization,,Published,2000,In Vitro Cellular and Developmental Biology - Animal,approved,jorgee.moreno,2020-01-09 23:35:05.989000+00:00,sync_user,2026-05-01 07:03:40.957000+00:00,https://pure.udem.edu.mx/en/publications/10b75fec-81c2-4029-a109-47dd064c6b68,bc0a73a3bfeeb8ef69ebdd612ba5cded8381a1fd,ResearchOutput,2020-01-09 17:35:05.989000-06:00,2026-05-01 01:03:40.957000-06:00,2020-01-09,2026-05-01,2020-01
2026-05-01,15747068,6ed82c70-cd99-4d43-b5b0-11a926381b84,ContributionToJournal,Epidermal growth factor receptors in rat ovarian tissue,J. Moreno-Cuevas; F. S. Khan-Dawood,032e6a6b-2256-4dc3-b523-ac05c6bd2927,2.0,,ExternalOrganization,,Published,1997,Tissue and Cell,approved,jorgee.moreno,2020-01-09 23:36:45.489000+00:00,sync_user,2026-05-01 07:03:59.225000+00:00,https://pure.udem.edu.mx/en/publications/6ed82c70-cd99-4d43-b5b0-11a926381b84,859e01589e0b7ff6413487f10ad1c53c1979bb1c,ResearchOutput,2020-01-09 17:36:45.489000-06:00,2026-05-01 01:03:59.225000-06:00,2020-01-09,2026-05-01,2020-01
2026-05-01,77091889,fb973fe8-1462-4552-a226-515a62af8c69,ContributionToJournal,Should I Stay or Should I Go? Job Embeddedness and Entrepreneurship in Highly Specialized Communities in Central Mexico,Dolly Ortiz; Osiel González Dávila,3bc1bc2f-6ba9-4532-89e0-6cc22b3d426b,2.0,,ExternalOrganization,,Published,2023,Journal of Small Business Strategy,approved,sync_user,2024-12-06 07:12:55.679000+00:00,sync_user,2026-05-01 07:04:20.385000+00:00,https://pure.udem.edu.mx/en/publications/fb973fe8-1462-4552-a226-515a62af8c69,f67b8134c05be7872ae463a98ff28457aea79710,ResearchOutput,2024-12-06 01:12:55.679000-06:00,2026-05-01 01:04:20.385000-06:00,2024-12-06,2026-05-01,2024-12
2026-05-01,84020900,2cc3a51c-e95e-4460-b425-8143bc3fb037,ContributionToJournal,Correction,Cristian A. Lasagna-Reeves; Urmi Sengupta; Diana Castillo-Carranza; Julia E. Gerson; Marcos Guerrero-Munoz; Juan C. Troncoso; George R. Jackson; Rakez Kayed,b800fab3-d115-408e-b411-277595e464bc,8.0,,ExternalOrganization,,Published,2026,Acta neuropathologica communications,forApproval,sync_user,2026-04-16 07:04:38.399000+00:00,sync_user,2026-05-01 07:03:36.330000+00:00,https://pure.udem.edu.mx/en/publications/2cc3a51c-e95e-4460-b425-8143bc3fb037,eedc03341edf4cb8685555c68414c4be9ecbc0e2,ResearchOutput,2026-04-16 01:04:38.399000-06:00,2026-05-01 01:03:36.330000-06:00,2026-04-16,2026-05-01,2026-04
2026-05-01,84087531,582f0773-3aff-4ba0-bec0-122a414425f0,ContributionToJournal,"Combined dark matter search towards dwarf spheroidal galaxies with Fermi-LAT, HAWC, H.E.S.S., MAGIC, and VERITAS",S. Abdollahi; L. Baldini; R. Bellazzini; B. Berenji; E. Bissaldi; R. Bonino; P. Bruel; S. Buson; E. Charles; A. W. Chen; S. Ciprini; M. Crnogorcevic; A. Cuoco; F. D’Ammando; A. de Angelis; M. Di Mauro; N. Di Lalla; L. Di Venere; A. Domínguez; S. J. Fegan; A. Fiori; P. Fusco; V. Gammaldi; F. Gargano; D. Gasparrini; F. Giacchino; N. Giglietto; M. Giliberti; F. Giordano; M. Giroletti; I. A. Grenier; S. Guiriec; M. Gustafsson; E. Hays; J. W. Hewitt; D. Horan; H. Katagiri; M. Kuss; J. Li; F. Longo; F. Loparco; L. Lorusso; G. Martí-Devesa; M. N. Mazziotta; J. E. McEnery; I. Mereu; M. Meyer; P. F. Michelson; N. Mirabal; H. Martínez-Huerta,39551e8c-89fd-4c72-a543-524f1c70e6a9,596.0,,ExternalOrganization,,Published,2026,Journal of Cosmology and Astroparticle Physics,forApproval,sync_user,2026-04-24 07:04:25.568000+00:00,sync_user,2026-05-01 07:04:12.493000+00:00,https://pure.udem.edu.mx/en/publications/582f0773-3aff-4ba0-bec0-122a414425f0,d7ebd05a4a727aaa5dce11cb7ae7d320f5826be0,ResearchOutput,2026-04-24 01:04:25.568000-06:00,2026-05-01 01:04:12.493000-06:00,2026-04-24,2026-05-01,2026-04
